{
  "state_abbrev": "WA",
  "researched_as_of": "2026-07-31",
  "researcher": "claude-sonnet-5",
  "session_note": "Washington operates on a 2025-2026 biennium: the 2025 regular session (105 days) was followed by the 2026 regular session, a 60-day even-year short session that convened Monday 2026-01-12 and adjourned sine die on Thursday 2026-03-12 (verified via legislature session-dates records, and cross-checked against the bill pages below, where the last House floor action on any bill occurred on 2026-03-12 and enacted 2026 bills carry a 90-days-after-sine-die effective date of 2026-06-11). Bills introduced in 2025 that did not finish carry over automatically into the 2026 short session under the same bill number; any bill not passed by both chambers and signed by the governor before 2026-03-12 sine die is dead for the 2025-2026 biennium and would need to be reintroduced as a new bill in the 2027-2028 biennium.",
  "decisions": [
    {
      "bill_key": "WA:HB 2515 (2025-26)",
      "outcome": "confirmed_unchanged",
      "fields": {
        "status": "Passed House 2026-02-14 (51-41) with floor amendments; in Senate referred to Environment, Energy & Technology then Ways & Means; returned to House Rules Committee by resolution 2026-03-12; session adjourned sine die 2026-03-12 without further action -- died for the 2025-2026 biennium",
        "bill_status_category": "failed_died",
        "last_action_date_iso": "2026-03-12",
        "chamber_of_origin": "House"
      },
      "confidence": 0.92,
      "evidence": [
        {
          "url": "https://app.leg.wa.gov/billsummary?BillNumber=2515&Year=2025",
          "title": "HB 2515 - Bill History and Status (Washington State Legislature)",
          "source_type": "legislature_bill_page",
          "supports": "Confirms the bill passed the House 2026-02-14 (51-41), was heard in two Senate committees, and was returned to House Rules Committee by resolution on 2026-03-12 with no gubernatorial action or session-law chapter recorded -- consistent with the bill dying at sine die.",
          "quote": "Mar 12: Returned to House Rules Committee by resolution. ... No gubernatorial action or session law designation appears on this record."
        }
      ],
      "notes": "Packet's April 2026 capture already correctly identified this bill as failed; this pass confirms the disposition is final for the biennium since the 2026 session adjourned sine die on 2026-03-12, the same date as the last recorded action, and no 2027 carryover is possible (new biennium requires reintroduction)."
    },
    {
      "bill_key": "WA:SB 5431 / SSB 5431 (2025-26)",
      "outcome": "confirmed_unchanged",
      "fields": {
        "status": "Passed Senate 2025-02-19 (48-0) and House 2025-04-16 (97-0); signed by Governor Ferguson 2025-05-20; enacted as Chapter 411, Laws of 2025, effective 2025-07-27",
        "bill_status_category": "enacted",
        "last_action_date_iso": "2025-05-20",
        "chamber_of_origin": "Senate"
      },
      "confidence": 0.95,
      "evidence": [
        {
          "url": "https://app.leg.wa.gov/billsummary?BillNumber=5431&Year=2025",
          "title": "SB 5431 - Bill History and Status (Washington State Legislature)",
          "source_type": "legislature_bill_page",
          "supports": "Confirms unanimous passage in both chambers in 2025, gubernatorial signature 2025-05-20, chapter designation C 411 L 25, and effective date 2025-07-27, matching the packet's recorded status.",
          "quote": "Current Status: C 411 L 25 (Chapter 411, Laws of 2025) ... Governor signed May 20, 2025 ... Effective date: July 27, 2025"
        }
      ],
      "notes": "This bill was already enacted in the 2025 long session, before the packet's April 2026 capture; no 2026 action applies since the bill is no longer pending. Status unchanged and final."
    },
    {
      "bill_key": "WA:SB 5982 (2025-26)",
      "outcome": "confirmed_unchanged",
      "fields": {
        "status": "Passed Senate 2026-02-11 (30-19), passed House with amendments 2026-02-28 (57-37), Senate concurred 2026-03-10 (30-19); signed by Governor Ferguson 2026-03-24; enacted as Chapter 181, Laws of 2026, effective 2026-06-11",
        "bill_status_category": "enacted",
        "last_action_date_iso": "2026-03-24",
        "chamber_of_origin": "Senate"
      },
      "confidence": 0.95,
      "evidence": [
        {
          "url": "https://app.leg.wa.gov/billsummary?BillNumber=5982&Year=2025",
          "title": "SB 5982 - Bill History and Status (Washington State Legislature)",
          "source_type": "legislature_bill_page",
          "supports": "Confirms Senate passage 2026-02-11, House passage with amendments 2026-02-28, Senate concurrence 2026-03-10, gubernatorial signature 2026-03-24, chapter designation C 181 L 26, and effective date 2026-06-11, matching the packet.",
          "quote": "Mar 10: Senate concurred in House amendments; final passage (30-19). Mar 24: Governor signed. Current Status: C 181 L 26 (Chapter 181, Laws of 2026). Effective Date: June 11, 2026"
        }
      ],
      "notes": "Confirms the packet's recorded enactment; this is one of three enacted bills in this packet."
    },
    {
      "bill_key": "WA:SB 6171 (2025-26)",
      "outcome": "confirmed_unchanged",
      "fields": {
        "status": "Introduced 2026-01-15, public hearing 2026-01-23, Environment Energy & Technology approved 1st substitute and referred to Ways & Means 2026-02-03/04; no further action; died in committee at sine die 2026-03-12",
        "bill_status_category": "failed_died",
        "last_action_date_iso": "2026-02-04",
        "chamber_of_origin": "Senate"
      },
      "confidence": 0.9,
      "evidence": [
        {
          "url": "https://app.leg.wa.gov/billsummary?BillNumber=6171&Year=2025",
          "title": "SB 6171 - Bill History and Status (Washington State Legislature)",
          "source_type": "legislature_bill_page",
          "supports": "Confirms the bill was referred to Ways & Means on 2026-02-04 and never received a committee vote or floor action afterward; page shows it remains parked in Ways & Means as of the fetch date (2026-07-31), well after the 2026-03-12 sine die, meaning it died for the biennium.",
          "quote": "Current Stage: The bill remains in the Senate Ways & Means Committee. It has not passed either chamber nor been enacted into law as of the last update."
        }
      ],
      "notes": "Packet's April 2026 capture already correctly identified this bill as failed/stalled; this pass confirms no further action occurred and the bill is dead for the 2025-2026 biennium since the 2026 session adjourned sine die on 2026-03-12 with the bill still in committee."
    },
    {
      "bill_key": "WA:SB 6231 (2025-26)",
      "outcome": "confirmed_unchanged",
      "fields": {
        "status": "Passed Senate 2026-02-28 (26-23) and House 2026-03-12 (51-46); signed by Governor Ferguson 2026-04-01; enacted as Chapter 266, Laws of 2026, effective 2026-06-11 (sections 2 and 3 effective 2026-07-01)",
        "bill_status_category": "enacted",
        "last_action_date_iso": "2026-04-01",
        "chamber_of_origin": "Senate"
      },
      "confidence": 0.95,
      "evidence": [
        {
          "url": "https://app.leg.wa.gov/billsummary?BillNumber=6231&Year=2025",
          "title": "SB 6231 - Bill History and Status (Washington State Legislature)",
          "source_type": "legislature_bill_page",
          "supports": "Confirms Senate passage 2026-02-28 (26-23), House passage 2026-03-12 (51-46), delivery to governor 2026-03-13, gubernatorial signature 2026-04-01, and chapter designation C 266 L 26 with effective date 2026-06-11, matching the packet.",
          "quote": "Feb 28: Third reading passed (26-23). ... Mar 12: Third reading passed (51-46). ... Apr 1: Governor signed. Current Status: C 266 L 26 (Chapter 266, 2026 Laws) | Effective Date: June 11, 2026"
        }
      ],
      "notes": "Confirms the packet's recorded enactment; the House vote on 2026-03-12 was the final floor action of the 60-day session, taken on sine die itself. This is one of three enacted bills in this packet."
    }
  ]
}
